{"artifact_id":"sha256:1e5273ce0efa4e45a2817364531a6778630604f0d5b04e69da1708ff1f936af2","business_contract":"EvidenceRun/EvidenceFact","context_status":"complete","coverage":{"omitted_unit_ids":["snapshot-unit:1bb31d1bfba643eeb04b8e13f19f39868972ff1bf30af837b48bdb6ac2c8da6b","snapshot-unit:c2e71c3c100a10dbae7833109bd7d9c34345a852c732accb701848292f35be89","snapshot-unit:8b37b06a1cf66b7cf3680f2ec589970fea957b489c0c2ec3294fa7113e58b026","snapshot-unit:eebd036c468e523f8d7312e7fd03a4b41a1e619912f8b75d61713fc514b6daad","snapshot-unit:112fce00677a17775ae163efe2a9b9e9784c957ecf45c01ae57d2b82c9ad805f","snapshot-unit:e27ac51be28ef6c744ae683a0efd22785921373c7be6e9c717689b5955650ca7","snapshot-unit:724ca76b39690a6c84f2e1804990e0f53b8d8bc90b2a980a7216103e0c363cdf","snapshot-unit:b4c37d0bdebb37faae45248ec2fad7ffc2f22eae4b340a078d20d5ac9dbf39c6"],"reason_codes":["prose_not_processed","role_scope_not_fully_covered"],"scoped_unit_ids":["snapshot-unit:ec9e9284ed986c96c6ce5d64f7d58fff8c303cc1f85b18329eb0dccfa61e435e","snapshot-unit:1bb31d1bfba643eeb04b8e13f19f39868972ff1bf30af837b48bdb6ac2c8da6b","snapshot-unit:c2e71c3c100a10dbae7833109bd7d9c34345a852c732accb701848292f35be89","snapshot-unit:8b37b06a1cf66b7cf3680f2ec589970fea957b489c0c2ec3294fa7113e58b026","snapshot-unit:eebd036c468e523f8d7312e7fd03a4b41a1e619912f8b75d61713fc514b6daad","snapshot-unit:112fce00677a17775ae163efe2a9b9e9784c957ecf45c01ae57d2b82c9ad805f","snapshot-unit:e27ac51be28ef6c744ae683a0efd22785921373c7be6e9c717689b5955650ca7","snapshot-unit:724ca76b39690a6c84f2e1804990e0f53b8d8bc90b2a980a7216103e0c363cdf","snapshot-unit:b4c37d0bdebb37faae45248ec2fad7ffc2f22eae4b340a078d20d5ac9dbf39c6"]},"error_codes":[],"execution_status":"deferred","payload_media_type":"application/json","payload_sha256":"sha256:cca6d9d43f1f145c6976efa5836e06efb5c4198b0f509710e7431a429b1129b2","protocol":"claims-json-v2","protocol_status":"not_checked","quality_status":"review_required","role":"claims","schema_version":"corpus-role-artifact-v1","snapshot_id":"sha256:d6546966ac517902659ed66c4fbdc7efd8512725a0ba1ef9d507844718bac055","task_id":"task:10a9877e41e045e7b6820d858cb9fc84a6adb95ae90df10582d34c89f8cef4d6","upstream_artifact_ids":[]}