{"artifact_id":"sha256:b792381e08db8641f0751c7896bf2cc675bcce1102ff053a6bbf161413e0cb44","business_contract":"MaterialRun/MaterialUnderstanding","context_status":"complete","coverage":{"omitted_unit_ids":[],"reason_codes":["no_relation_candidates"],"scoped_unit_ids":["snapshot-unit:b3f72c68399a83bd4b938bdb8d90e96911fe411a2462adc15d6b92248b207f21"]},"error_codes":[],"execution_status":"succeeded","payload_media_type":"application/json","payload_sha256":"sha256:54aaeaecd585986c136faf297cc9a168d7defd3c67ef79afb1a5d50cc3eb1396","protocol":"material-relations-jsonl-v1","protocol_status":"valid","quality_status":"accepted","role":"material_relations","schema_version":"corpus-role-artifact-v1","snapshot_id":"sha256:3a3fe23543d25c68d498bf97ae1437da735ab91732f34e7e9973b308e7e8a972","task_id":"task:4e38f146f5d74c5bb26f91d8c2a358b496c1d2c0ae27cd277859509a43fb8a33","upstream_artifact_ids":["sha256:11d9a8a490e2b330adcb7313acb31ec81f1535733ddad91e73d436079695a33d"]}