{"artifact_id":"sha256:b914f24a7e6b47ac17ea3648c86afa890c9fd1168de794ca1083f0c55a4e9b95","business_contract":"MaterialRun/MaterialUnderstanding","context_status":"complete","coverage":{"omitted_unit_ids":[],"reason_codes":["no_relation_candidates"],"scoped_unit_ids":["snapshot-unit:5a89925485629a1f6a034dd08cc20d9170157cf5d48dba6fb28ddd85e52b6764"]},"error_codes":[],"execution_status":"succeeded","payload_media_type":"application/json","payload_sha256":"sha256:6f65eb81b78efce16bb2dd71dd2b74402c0ffd8050d2b772c04c09b8cd779ffd","protocol":"material-relations-jsonl-v1","protocol_status":"valid","quality_status":"accepted","role":"material_relations","schema_version":"corpus-role-artifact-v1","snapshot_id":"sha256:6ac2e58aff2d0b272bba832e419aaadbff410a8fdbf6a82d6c13a365f94f1016","task_id":"task:8ae22c83ad8a9cb5a185b41cee1a567ff3aa4d3de601d81c049636e462bfc961","upstream_artifact_ids":["sha256:3c1aeb921b250d1d44c9ce4dc9aa5b4ae4a153bbc8b10f14eef50e4e3077e94c"]}