{"artifact_id":"sha256:fb2acaa067204107d4a8d4053f4b6ec52455c924a020065ce2fa79d19b465ebd","business_contract":"MaterialRun/MaterialUnderstanding","context_status":"complete","coverage":{"omitted_unit_ids":[],"reason_codes":["relations_not_requested"],"scoped_unit_ids":["snapshot-unit:d7b969ff83447442a34235ddd1eee1148e36f25982fff33b66df9bf97e93822d"]},"error_codes":[],"execution_status":"succeeded","payload_media_type":"application/json","payload_sha256":"sha256:48113bbb6a3c3fde17b1ef4499cd2bab4e30e1d62bbcaf4a56b9755b4d179e30","protocol":"material-atomic-jsonl-v4","protocol_status":"valid","quality_status":"accepted","role":"material_items","schema_version":"corpus-role-artifact-v1","snapshot_id":"sha256:cb66eefabda1b63afa0276f6923af830df149b6d4f2d84ba16ae835e7af63c79","task_id":"task:55c606f450e7c4ee37421e3ea1785259c45ae21edccc54b86c34f7c94a74b412","upstream_artifact_ids":[]}