{"artifact_id":"sha256:49cd1738d7f82d8d1976c5f9bf271e46cae4380e96c9b01872892d52bccd4a75","business_contract":"MaterialRun/MaterialUnderstanding","context_status":"complete","coverage":{"omitted_unit_ids":[],"reason_codes":["no_relation_candidates"],"scoped_unit_ids":["snapshot-unit:d7b969ff83447442a34235ddd1eee1148e36f25982fff33b66df9bf97e93822d"]},"error_codes":[],"execution_status":"succeeded","payload_media_type":"application/json","payload_sha256":"sha256:88aa2ea019c7bdc6b3b6696ff39a331c1b11a6bb4781aff1d20a07383f0dbe09","protocol":"material-relations-jsonl-v1","protocol_status":"valid","quality_status":"accepted","role":"material_relations","schema_version":"corpus-role-artifact-v1","snapshot_id":"sha256:cb66eefabda1b63afa0276f6923af830df149b6d4f2d84ba16ae835e7af63c79","task_id":"task:8f7672f97bfc705689d979e3db36e4cd920d95cc9e48cc32d87efcaad3c8c874","upstream_artifact_ids":["sha256:c4d9608dfa0fcbb9eee01b5826f802cec43eddb09b1d73f6f7786fc5d0d6a87f"]}