{"artifact_id":"sha256:6516e8841081445ba626e1a887e353e5c62678fa40a8957decad5787d66154f2","business_contract":"MaterialRun/MaterialUnderstanding","context_status":"complete","coverage":{"omitted_unit_ids":[],"reason_codes":["relations_not_requested"],"scoped_unit_ids":["snapshot-unit:f37e7573308033f912525b9a2627d31ee12c7c0c06ba5c04e9359dd20cc0d3ae"]},"error_codes":[],"execution_status":"succeeded","payload_media_type":"application/json","payload_sha256":"sha256:40fce30eac5286fbc13ba5bdee5a373f959f706900afc9ccb798fa2e14b67f10","protocol":"material-atomic-jsonl-v4","protocol_status":"valid","quality_status":"accepted","role":"material_items","schema_version":"corpus-role-artifact-v1","snapshot_id":"sha256:8470cfd25575c77404774bbe79bb52d9ea20a5bd3546aa2ca240dac04976fdf4","task_id":"task:b9f88c500e4c682dd5efb13ffe5d0ba7b269814710b95d9d7e962376e39d641b","upstream_artifact_ids":[]}