{"artifact_id":"sha256:083c7e4ba7955b82e976ffe90d874be29c2762b5da0795d26505f6d7d730bb80","business_contract":"MaterialRun/MaterialUnderstanding","context_status":"complete","coverage":{"omitted_unit_ids":[],"reason_codes":["relations_not_requested"],"scoped_unit_ids":["snapshot-unit:6ec5cecf7239672a2b430eb25c02b291c840485b53d4b21e058ef5894336d609"]},"error_codes":[],"execution_status":"succeeded","payload_media_type":"application/json","payload_sha256":"sha256:b1b54234b9a2bc63ef9c7873d1c0d7d164d41767cc3976ece3eac7e426af3f0d","protocol":"material-atomic-jsonl-v5","protocol_status":"valid","quality_status":"accepted","role":"material_items","schema_version":"corpus-role-artifact-v1","snapshot_id":"sha256:110f8628eb71a3495153f05453c93c3fe5e04ba970d0846448eb1b37f0c7627d","task_id":"task:89efa2545dfde0bb3638394c627aeffb7b219ab397c8f0e151aa848077772826","upstream_artifact_ids":[]}