{"artifact_id":"sha256:bb6d68369230f5128539d07bffc8e359ef2e7474d474f26f0a517f6787967465","business_contract":"MaterialRun/MaterialUnderstanding","context_status":"complete","coverage":{"omitted_unit_ids":[],"reason_codes":["relations_not_requested"],"scoped_unit_ids":["snapshot-unit:5a89925485629a1f6a034dd08cc20d9170157cf5d48dba6fb28ddd85e52b6764"]},"error_codes":[],"execution_status":"succeeded","payload_media_type":"application/json","payload_sha256":"sha256:2cacaec3ea7cd3e3dc0fb34b71fa695cd21b4efc535c5d8e9d2e6b20a091c8cb","protocol":"material-atomic-jsonl-v4","protocol_status":"valid","quality_status":"accepted","role":"material_items","schema_version":"corpus-role-artifact-v1","snapshot_id":"sha256:6ac2e58aff2d0b272bba832e419aaadbff410a8fdbf6a82d6c13a365f94f1016","task_id":"task:94286bad80592d959fc463d7a5a8eb2c28c506b7698a2a282734c5be7addc5c3","upstream_artifact_ids":[]}