{"artifact_id":"sha256:672a108ec28b35845d2ab34788fec3ef64d4c32dfd96320a1de89cad4fef9135","business_contract":"MaterialRun/MaterialUnderstanding","context_status":"complete","coverage":{"omitted_unit_ids":[],"reason_codes":["no_relation_candidates"],"scoped_unit_ids":["snapshot-unit:f37e7573308033f912525b9a2627d31ee12c7c0c06ba5c04e9359dd20cc0d3ae"]},"error_codes":[],"execution_status":"succeeded","payload_media_type":"application/json","payload_sha256":"sha256:11f2586fd04fae87253d0dd40b8a1ac120f324e0fc7467030ab316900b528796","protocol":"material-relations-jsonl-v1","protocol_status":"valid","quality_status":"accepted","role":"material_relations","schema_version":"corpus-role-artifact-v1","snapshot_id":"sha256:8470cfd25575c77404774bbe79bb52d9ea20a5bd3546aa2ca240dac04976fdf4","task_id":"task:b36a2466803be2fd8952dbbcfe007159c30702ae9bd65e790999d31f0014cd36","upstream_artifact_ids":["sha256:6516e8841081445ba626e1a887e353e5c62678fa40a8957decad5787d66154f2"]}