{"artifact_id":"sha256:1d8ba5d921e0c73664670fe19e668072a82d808de2d0cd012edaca785d114c23","business_contract":"EvidenceRun/EvidenceFact","context_status":"complete","coverage":{"omitted_unit_ids":[],"reason_codes":[],"scoped_unit_ids":["snapshot-unit:8d394c698e0418108d8303d2efeef59c63283bec92e75abe0235a5f1bd73a023","snapshot-unit:6dbca47cc707989787535208e9b347c0b1bbc3ccb2d0940ad7cac645c4a30e26","snapshot-unit:533db57d78cb2d1335159a30423fb6addfdd072c62f5cdab4702a3d9b6715da8","snapshot-unit:e108813cd02da111d2a08085611e5377d9c4a3f07965cebf70504ffc0e1f8f44","snapshot-unit:a505dd3e65df68b5dbb08fbefc245ce17c78ebd25d537642e9736059189ab411","snapshot-unit:3cf9bb286069a761ac8207565008d250f238b38a17017ed6146ab2d42b4fecd0","snapshot-unit:ead7aa83518e1ef0982328ae166e7261ac3035eb7f0344df6eff7e0def8ca92c","snapshot-unit:6bed4788df694b3eb1ff7feba6b58ce473796fdaef83f4f0e047dd4a60f41e11"]},"error_codes":[],"execution_status":"succeeded","payload_media_type":"application/json","payload_sha256":"sha256:88ffceca35e0d6aa88eb5c7d6c082e041f103f35f505a39c3c60f30507e32681","protocol":"claims-atomic-json-v2","protocol_status":"valid","quality_status":"review_required","role":"claims","schema_version":"corpus-role-artifact-v1","snapshot_id":"sha256:7d8f27c875796ee3ace724131f2e8f7d3c5bf08ea85b919e6fe5b722a7fa7195","task_id":"task:8186e1c74f7c0aec5574c914274ce68f9995d94e890f751c89b350573f8bea63","upstream_artifact_ids":[]}