{"artifact_id":"sha256:dad7d51f54c01f2bab5093ca7cf6c6680224917f1cce6336c68af766f1d1a896","business_contract":"MaterialRun/MaterialUnderstanding","context_status":"complete","coverage":{"omitted_unit_ids":["snapshot-unit:5a89925485629a1f6a034dd08cc20d9170157cf5d48dba6fb28ddd85e52b6764"],"reason_codes":["relations_not_requested","atomic_obligations_incomplete","role_scope_not_fully_covered"],"scoped_unit_ids":["snapshot-unit:5a89925485629a1f6a034dd08cc20d9170157cf5d48dba6fb28ddd85e52b6764"]},"error_codes":[],"execution_status":"failed","payload_media_type":"application/json","payload_sha256":"sha256:aa7babfbf09c170be6625d6aa377e9686ce40293c55c1e3d64e8676841c66f7c","protocol":"material-atomic-jsonl-v4","protocol_status":"not_checked","quality_status":"review_required","role":"material_items","schema_version":"corpus-role-artifact-v1","snapshot_id":"sha256:6ac2e58aff2d0b272bba832e419aaadbff410a8fdbf6a82d6c13a365f94f1016","task_id":"task:53482edcd9fb9adfafc191d4ec4dabd7722d219dfcc3a0023e6b307bb939fa13","upstream_artifact_ids":[]}